reviews_text,reviews_header,Asin
One of the best products and the i am luving it . As i am using these products from the days of beston electronis. iam happy with their all products . Happy business Kevin !!,Value for Money the best INDIA Product for Indians.,B072QD8QKL
Wonderful &Excellent TV in LOW BUDGET. I've Fully Satisfied with this TV. I buy 2 PCs.,WONDERFUL & EXCELLENT,B072QD8QKL
Full fill your led tv dream with this. I promise this product is never disappoint you. Go for that.,Super value for money 👍👌,B072QD8QKL
I'm happy with the product The installation guy came on the same day and on the correct time That was really helpfull. Thank you so much Amazon,Great product,B072QD8QKL
I was looking for an Economic option in HD Range. Using this TV for last 2 Months and performance is absolutely fine and the product is Value for Money.,Kevin Review,B072QD8QKL
Very good product,Fabulous,B072QD8QKL
"Picture quality is very good. Smart features is also cool. Sounds are good, external speakers are not required.","Awesome product,Go for it",B072QD8QKL
"With this price range, the features of TV are well enough. Sound and picture quality are also good. This review is after 2months of usage.",Well Budgeted TV,B072QD8QKL
Dose not come with battery and cheap quality clamps,Value for money,B072QD8QKL
Very good picture quality,Best tv,B072QD8QKL
Super☺,Sema,B072QD8QKL
"Value for money,great picture quality at this price range.",Value for money,B072QD8QKL
I like this product. It is value for money. I am using from since 1year. Thanks Kevin.,Excellent Tv no problems,B072QD8QKL
"Nice product...Picture Quality is good. Sound is very nice loud and clear...very light weight... I've also kevin 32"" smart LED....my experience with Kevin is awesome...",Great product for reasonable price,B072QD8QKL
AEWSOME QUALITY PRODUCT,BEST CHOICE,B072QD8QKL
Best tv in best price,Budget tv,B072QD8QKL
"I got this for approximately 7k, and for that price this is a really good TV that too 32inch, I think this is definitely worth for 9k. Except for sound which generally is a weak point for all led to this is really good in all aspects",Very good,B072QD8QKL
Nice,Nice,B072QD8QKL
At this price what else u can expect. Day 1 went with good performance. I bope it will long live,Good buy at this price,B072QD8QKL
"TECHNICIAN INSTALLED BUT TV NOT FUNCTIONING....FROM HIS WORDS, 99% TV WORKS BUT THIS IS THE ONE , FAULTY U RECEIVED, ANYWAYS AMAZON RETURN POLICY WILL HELP HERE.",I FEEL I'M THE MOST UNLUCKIEST TO RECEIVE A FAULTY TV,B072QD8QKL
Nice picture quality..,Must buy,B072QD8QKL
Nice product,Good,B072QD8QKL
Very nice picture Very nice sound and HD picture osm Very happy my family 😀😀😀,Super TV OSM,B072QD8QKL
Great product for the price as I bought it for 4800 very much satisfied with the picture quality and sound,Kevin led,B072QD8QKL
Very nice product in this price,Best quality best price,B072QD8QKL
the sound is amazing budget TV for this price range really loved..,Best Tv,B072QD8QKL
Whorst product quality is dead sounds is very bad,Bad very bad,B072QD8QKL
Very good,Very good,B072QD8QKL
value for money,cheap and best,B072QD8QKL
Simply supero super... Please buy that products are hopeful...,Super,B072QD8QKL
The product is good to compare to going with the highest brand value.,Excellent Television,B072QD8QKL
Awesome,Awesome,B072QD8QKL
Picture quality is normal . Sound is very good . TV light weight . Worth for money budget TV . Overall good .,Budget hd TV,B072QD8QKL
Picture quality was good,Nice product,B072QD8QKL
No Sound clarity,Not bad,B072QD8QKL
Mirroring option not available which I expected. Otherwise good,Good,B072QD8QKL
Good Led TV in this price,Best product,B072QD8QKL
Good,Nice,B072QD8QKL
Very good product and very good picture quality sound quality ii also very good,Amazing,B072QD8QKL
The product quality was beyond my expectation. It is 100% value for money.,100% value for money.,B072QD8QKL
Good,Good,B072QD8QKL
quality at affordable price,good product at afforable price,B072QD8QKL
Everything thing is very good I'm using it since Month and I would suggest if you want budget led TV so you can definitely 😉 go for it,Perfect tv for low budget peoples,B072QD8QKL
"Picture quality is super good, worth the money and good sound quality","Trustworthy for this money, good product",B072QD8QKL
It's amazin,Good quality product,B072QD8QKL
Kevin tv worked only one month and it did not work Then I tried to talk with customer care but they did not respond properly Tell us how to use warranty card,Help to warranty claim,B072QD8QKL
"In low budget,it's worth of money. I have started using from last month's and every things are satisfactory.",Kevin worth of money,B072QD8QKL
Got it for 4999/- .. good for rented place,Good for small budget,B072QD8QKL
Good product... Good sound quality. Value of money,Good product,B072QD8QKL
Sound is not working plz send customer num kevin company,Sound is not workin,B072QD8QKL
Picture quality is good Smart features is ok Sound quality is ossum with inbuilt sound bar Finally super product in this price,Super product,B072QD8QKL
Awesome products,Worthy in this price range,B072QD8QKL
Mast hai,Very very good product,B072QD8QKL
"Best buy, bought it for 6300 (6999 - 10% SBI CC) Best value fof money product, just go fot it.",Best TV at this price,B072QD8QKL
Great item packaging was great. Features are great . Value 4 money,Best for price,B072QD8QKL
Good quality & best picture quality.......Sound also good,Best tv in budget price..,B072QD8QKL
Jai hind... Be Indian buy Indian.,Indian made TV,B072QD8QKL
Very good product. I like this tv very much. Most trusted tv.,Kevin the best quality for the price,B072QD8QKL
"price good,vary good prodact",price RS-5k good,B072QD8QKL
Reasonable led tv for a reasonable price. Looks good and sound quality is good.,Good led tv in this price segment,B072QD8QKL
Superb and value for money,Bang for your buck,B072QD8QKL
"I like it, tv is very good in quality and its service. Outstanding!",Wonderful quality,B072QD8QKL
"Very good product and this price, picture quality is awesome.just go for it.",Best product,B072QD8QKL
Awesome quality product at very affordable price. By the way I'm using this TV as my PC monitor.,Great TV AT AFFORDABLE PRICE,B072QD8QKL
Super product... I give 5 star this product. Picture quality is awesome and smart features is very good and advanced. Thanks Kevin...,Super Kevin,B072QD8QKL
Good TV. Value for money,Good,B072QD8QKL
Awesome TV this prize,Kevin super,B072QD8QKL
More than expectations... Value for money,Wowwww,B072QD8QKL
No problems till now,Good product with reasonable price,B072QD8QKL
Nice product.. super quality sound and picture.. value for money...,Good product,B072QD8QKL
Nice one with too little amount,Value for money,B072QD8QKL
Awesome,Satisfied,B072QD8QKL
"Picture quality nice and decent not very great, sound and connectivity is great",Connectivity and sound are great,B072QD8QKL
Excellent performance Comparatively cheap price,My review,B072QD8QKL
Good Quality product at this cheap prize,Kevin,B072QD8QKL
Low price premium quality,Best led,B072QD8QKL
Good Product in this price,Nice one,B072QD8QKL
"I liked everything including picture quality, transportation, installation, happy owner. But, it is just 1 year warranty. You have to pay extra for extra 2 yrs warranty.",Great product at affordable price.,B072QD8QKL
In small budget ..Product is good .,👍,B072QD8QKL
Best product at reasonable price,Worthy product,B072QD8QKL
Good,good,B072QD8QKL
It's a great budget tv. I purchased it on the Amazon sale on 19/01/2019. for Rs-7200. Picture and sound quality nice.installation guy came very quickly after I requested.as usual good experience of buying from Amazon.but there is one more thing use HD setup box instead of SD for more clarity in picture.,Saurabh saxena,B072QD8QKL
Product was delivered on time. Nice TV with good picture & sound quality ..got in cheaper rate during Amazon sale.,"Awesome product, just go for it",B072QD8QKL
Awesome product in low price Most buy ....But after 10 days used this product sound quality is down.....,Excellent,B072QD8QKL
The TV is very compact having good and required basic features. The price is also very affordable,Features with an affordable price,B072QD8QKL
The picture quality is so good even in low resolution videos Surround sound system is mind blowing it is so loud even in the bigger room The best TV in the budget price,The best TV for price and quality,B072QD8QKL
Good led tv 24 inch,Hassan,B072QD8QKL
Best TV of the year Under 6000rs,Best TV,B072QD8QKL
Can improve with picture quality and sound for sure but anyway its value for money. Thank you,Review,B072QD8QKL
Very Good LED TV,Very Good LED TV,B072QD8QKL
Happy with the product,Happy,B072QD8QKL
I have bought the TV in great Indian festival.its working great with good quality,Nice build at this cost,B072QD8QKL
Everyone sud buy this tv if looking for this range. Overall 10 out of 10 Picture 9 out of 10,Value for money,B072QD8QKL
Very good product,Very good picture quality and sound best product,B072QD8QKL
All are well but no response from SERVICE agencies. Is any SERVICE agencies in telangana state WISE districts. Please inform me.,Satisfied with kevin 24 inches tv.,B072QD8QKL
Very affordable led tv.. Thanks to kevin,Very nice tv,B072QD8QKL
TV automatically getting off and restarting repeatedly....👎...my money was wasted...disappointed...👎,Restarting n getting off automatically...,B072QD8QKL
Super,Super,B072QD8QKL
Good product best quality fast delivery good customer support,Best led this price,B072QD8QKL
Its good,Good,B072QD8QKL
Wall mounting didn’t received,Wall mounting did not received,B072QD8QKL
"Quick delivery and installation, working fine, looks good on desk but cover space for wall-mount",Best LED on lowest price,B072QD8QKL
Excellent sound and picture quality,Excellent sound and picture quality,B072QD8QKL
Good Product at very cheap price. Branded product.,Old Brand and very nice product at very cheap price.,B072QD8QKL
Simply awesome I never expect this quality on this price range,Kevin 32inch Led TV,B072QD8QKL
Good tv..but installation problem.... any person don't care for installation..I call no response...plese come for installation....,Installation problem...pls come for installation,B072QD8QKL
"####update#### The color and sound quality can be changed to suit your need. It looks much better now. Of course you can't match a high end TV, but it looks much better now compared to my last review. ###old### First I was excited about a 32 inch LED for 7K but later realized, cheap TV means cheap features. The picture quality is always reddish. The Sound quality has lots of echo, so not audible at times.",You get what you pay for...,B072QD8QKL
Good product using last five months,Good product,B072QD8QKL
Nice product in chiep rate.,Nice product in chiep rate.,B072QD8QKL
Value for money,Value for money,B072QD8QKL
It's been more than a week since I ordered this TV and no one from Kevin contacted me regarding installation. I tried calling them several times and their is busy . I reached amazon support twice regarding this and they promised to escalate it to the seller but that never happened. POOR PRODUCT AND CUSTOMER SERVICE. DONT GO FOR KEVIN. PLS GO FOR SOME BRANDED PRODUCTS. BRAND IS ALWAYS BRAND. I WASTED MY MONEY.,POOR CUSTOMER SERVICE BY KEVIN,B072QD8QKL
The best device to have at modicum budget.,Very good product,B072QD8QKL
TV fitting yet no one knows how to get involved,FItting,B072QD8QKL
Good,Good,B072QD8QKL
Good,Awesome,B072QD8QKL
Lowest price and value for money.,Lowest price LED TV and value for money.,B072QD8QKL
Good product for affordable price,Nice quality,B072QD8QKL
Excellent picture quality and sound system too👌,Worth,B072QD8QKL
The glass case fell off from the frame on its own and there are absolutely no customer care numbers that are accessible!! Tv as such is a fine product but what's the point if a simple issue like this can't be fixed? Wouldn't recommend purely because of the lack of service centers,Customer care is non existent!!,B072QD8QKL
"They have told me that, they will extend warranty if i will give them 5star ranking. After no response. Not good",Response not good,B072QD8QKL
Realy very good product and service,Very clear,B072QD8QKL
We satisfied with cost of Tv,Kevin TV is low cost if compare with other TV's.,B072QD8QKL
"Picture quality is really good, and accessing the features looks easy. Over all, it's a great TV for this price band.",Good TV,B072QD8QKL
I am satisfied. I tried to connect dongle but HDMI port is inconvenient. Difficult switch dongle button. Other ports r OK.,Good TV.,B072QD8QKL
Worthy,Good,B072QD8QKL
Good,Good,B072QD8QKL
Excellent,Good,B072QD8QKL
Value of money Nice product 👌,Thanks Amazon,B072QD8QKL
Very excellent product....nice quality of picture sound everything very reasonable price n effective results,TV REVIEW,B072QD8QKL
Picture and sound quality is great. Working perfectly.,It was a great deal and working perfectly.,B072QD8QKL
At this price is some what ok ok.picture quality is not so good but you can use as second instrument in bedroom or in shop,Ok,B072QD8QKL
Good product at cheap rate and good service,Nice product,B072QD8QKL
Good,Happy,B072QD8QKL
"No any disike this products, money value product... best price best quality.... i love it... kevin tv😘😘😘",Best value for money tv 2019,B072QD8QKL
Bought 2 tv .both working fine.,Budget killer,B072QD8QKL
"It say's compatible with wireless headset, but there is no option to use wireless headset.",Ok,B072QD8QKL
picture quality is too good....,value for money.....than sumsung,B072QD8QKL
It's very good and affordable product.,Very Good Product,B072QD8QKL
Ossam product,Nice product,B072QD8QKL
Excellent product ...,Excellent Product.. Working Superbly.,B072QD8QKL
"Really price is good. Quality is also very good of sound , picture.. it's light weight. I will give 5 🌟",Excellent performance..,B072QD8QKL
Good product and cheapest as well so must buy,Good product,B072QD8QKL
Sound quality & feature quality are excellent. Picture colour is very bright I would prefer a bit softer..it very nyc tv,Excellent tv..!!,B072QD8QKL
Ok,Satisfied,B072QD8QKL
i like kevin product,kevin led tv is nice product at affordable price,B072QD8QKL
good television with reasonable price,Good TV,B072QD8QKL
Pic quality good,No Full HD,B072QD8QKL
Happy with product,Happy with the product,B072QD8QKL
"Great product, worth every penny !!",Awesome purchase,B072QD8QKL
i have purchased tv in jan sale.it is best product in this price. the picture and sound quality is owesome.,five star,B072QD8QKL
Nice tv,Nice TV at this price range,B072QD8QKL
Nice,Great product,B072QD8QKL
Good product,Good,B072QD8QKL
Good tv,Good tv,B072QD8QKL
Its very good and working fine.,Awsm..... 🤩,B072QD8QKL
"Very good Tv .Value for money ....Its amazing purchase for this price...Picture quality and sound quality good for the price u pay.It has Usb ports, hdmi port, vga port.Besr KEVIN customer care for installation....I already bought 6 products including smart tv and monitors..thanks",Very good Tv .Value for money ....Its amazing purchase for this price..,B072QD8QKL
Product is good and also quality.,This product is good quality and nice sound.,B072QD8QKL
I got this product on 19th today is 24th but till now no one come for installation. Product is good,Too late installation,B072QD8QKL
Super quality..it is worth,Nice one,B072QD8QKL
Super quality.. Nice picture view,Super picture quality,B072QD8QKL
Very good in this price. Happy customer.,Very Good in this price..,B072QD8QKL
Best Product in low budget...,Super,B072QD8QKL
Good price & exclinte picture and sound quality,Best sound quality,B072QD8QKL
Nice product as expected,Cool product,B072QD8QKL
The product is best at its price,Awesome product,B072QD8QKL
Superb LED TV this price,Good LED,B072QD8QKL
Nice tv with good picture quality.,Awesome purchase,B072QD8QKL
Super tv worth for money,Super,B072QD8QKL
Nice,Nice,B072QD8QKL
Good picture quality,Kevin Color tv picture quality,B072QD8QKL
Be aware you cannot return this item if you have find it to be poor quality. Amazingly stupid policy by Amazon on it's TVs in general. Much better to buy TVs from a local store. Very bad panel. Blacks are terrible with no detail. Causes headaches with more than 10 minutes of sustained viewing. Nothing can be done so donating it to my driver,No refunds non returnable! Don't buy TVs from. amazon headaches from flicker.,B072QD8QKL
Nice picture quality with sound,picture quality,B072QD8QKL
Picture quality nice and sound quality also very clear and loud,Very good LED TV,B072QD8QKL
Value for money. Very good product for the price ranfwni bought.,Very Good,B072QD8QKL
Best qualities,Nyc,B072QD8QKL
Good product and good customer care support...must buy worth the money,Gud,B072QD8QKL
Good TV,Good TV with budget cost,B072QD8QKL
Excellent,Super,B072QD8QKL
Everything is good,Excellent,B072QD8QKL
"Using last two months . satisfied, happy, values of money.good job flipkart & Kevin.Keep it up. Thankyou.",Good product.,B072QD8QKL
"Picture quality, sound quality are very good.",Good value for money,B072QD8QKL
Very good product!! And this LED TV is best in this budget! I am happy with this LED TV!!,Very good product!!,B072QD8QKL
super clarity both audio and video best budget tv for middle class,awesome tv at budget price,B072QD8QKL
Very nice,Very nice,B072QD8QKL
Good Picture and Sound,Best LED tv By Kevin,B072QD8QKL
At this price this TV amazing so no doubt u can buy it without second thought,No second thought buy it now true,B072QD8QKL
Very nice product... awesome,Awesome,B072QD8QKL
Good Product,Good Product,B072QD8QKL
Good,Good,B072QD8QKL
Best tv in my budget ...Very good sound quality ...Go fot it ...,Best TV ..plan to buy 43inch smart TV,B072QD8QKL
Best Budget Tv ❤️❤️❤️,One of the best Tv😍,B072QD8QKL
Good,Nice,B072QD8QKL
Excellent at that price!!!!,Superb picture quality,B072QD8QKL
Excellent all Features,Excellent👍👏,B072QD8QKL
Good product i am impressed,Kavin 32inches LED TV,B072QD8QKL
Seems to be good so far,Good,B072QD8QKL
Hi I am using last 5 month for Kevin LED TV it's picture and sound quality 👌 no issue still time 😁,***value of money ***,B072QD8QKL
Good product at less price,Good product,B072QD8QKL
Very nice,I loved,B072QD8QKL
This product is very nice.,Excellent product .,B072QD8QKL
Very good till now...very light but sounds sturdy ...bought for mother old and can’t see big far tv hence ....good buy ...remote is not very effective though...doesn’t work when close to tv,Good and cheap,B072QD8QKL
Bad sound quality,"On this led tv,Power led indicator fused only in 1 months of tv used.",B072QD8QKL
"Worth every penny.,",Nice purchase.,B072QD8QKL
"Ok, at this price range",Good,B072QD8QKL
Super,Super,B072QD8QKL
"Wow.... Nice tv kevin 24"", good picture quality, and sound,","Kevin 24""",B072QD8QKL
We love this products. We purchased 5pieces of TV. Every TV purchaser must go for this product 😊,Wonderful product,B072QD8QKL
Very good tv at this price,good tv at cheap price,B072QD8QKL
I like sound and picture quality,Clear picture with good sound,B072QD8QKL
Good product,Very very nice,B072QD8QKL
Nice and perfect quality,Worth buying,B072QD8QKL
"Display & panel between lot of gap, Panel quality is not good & amazon customer also not good response.","Don't buy any Electronic item from amazon,and customer service is very poor.",B072QD8QKL
This tv is good and sound quality is awesome.,Great at price,B072QD8QKL
Awesome product,Awesome,B072QD8QKL
Ohk,Good,B072QD8QKL
Very good product for good price,GOOD PRODUCT,B072QD8QKL
Gud resolution,Thnk u,B072QD8QKL
In budget LED ..,Too Good,B072QD8QKL
Nice tv,I,B072QD8QKL
Amazing led tv in low price.picture quality is very good.sound quality is best,Brilliant,B072QD8QKL
"It has good sound, & picturisation quality is also very nice I am happy with the product.",9752888155,B072QD8QKL
Product is good,Excellant,B072QD8QKL
I purchased this TV in Feb 2019 and it is working fine. Now again purchased one for my mother. Value for money and working fine. Make in India really brought the price affordable,Affordable smart TV,B072QD8QKL
I like this product,Clarity,B072QD8QKL
Superb,Worth buying,B072QD8QKL
Best in this price,Great one,B072QD8QKL
Ok,Good screen,B072QD8QKL
Good product 👍,Good,B072QD8QKL
Good tv,Good,B072QD8QKL
Good product,Excellent picture quality and sound,B072QD8QKL
Nice product,Good quality,B072QD8QKL
I had a kevin tv... its gud product... gud quality... pictures.. i played everthg... gud thank you amazon n kevin,Gud product,B072QD8QKL
Nice,Nice,B072QD8QKL
"Very poor quality, in one month TV is not working",Kevin tv needs to give best quality to their Coustomer,B072QD8QKL
Awesome,😊😊😊,B072QD8QKL
Picture and sound quality is very good in this price range.,Gud quality in budget,B072QD8QKL
Good,Worth for money,B072QD8QKL
"I bought this tv from amazon. Picture quality is good, Smart features & sound quality are excellent for the price.",Best TV in this price,B072QD8QKL
Good,Good,B072QD8QKL
Value for money. Good sound quality. Using as external monitor for my laptop and tv as well.,Value for money,B072QD8QKL
Good . Tq,I like,B072QD8QKL
Super features and quality,Super TV for economic price,B072QD8QKL
The tv is very good,Good,B072QD8QKL
Good,Good,B072QD8QKL
Good,Good product,B072QD8QKL
Best@price,Buy this,B072QD8QKL
Best product with reasonable price good Picture quality and good look Awesome product 5****,Good product with Reasonable Price!!!,B072QD8QKL
Nice tv in this price segment.,Good Kevin,B072QD8QKL
It is a very good product for the price. Had got in amazon sale and do not regret it. At that price its difficult to get a LED. Am fully satisfied with the product. Keep it up,Best product for the price,B072QD8QKL
Good picture and sound quality in low price.,Good picture and sound quality,B072QD8QKL
Bill quality is bad,Bill guality bad,B072QD8QKL
Nice 1,Paisa wasool,B072QD8QKL
Good product,Good,B072QD8QKL
80% west product,Smart tv,B072QD8QKL
"Good quality, worth for money, still now no issue, TV pictures quality also good. Worth to buy",Good,B072QD8QKL
"Worth every penny... Got it for 4950 INR during great Indian sale Lots of connectivity option under 5k range.. HDMI,USB, RF, multiple AV port... Just incredible..",Worth every penny,B072QD8QKL
Kevin LED TV is Nice product,Nice,B072QD8QKL
Best,Best,B072QD8QKL
Good product,Product is very nice,B072QD8QKL
Good,A worth product for it's price,B072QD8QKL
"It's very good picture quality,sound is average and loud , good tv in the price of 4990. And nice delivary service. I am satisfied 5 star.",Best tv at low price,B072QD8QKL
Nice Budget TV.,Go for it.,B072QD8QKL
"Good product, it’s working perfectly since I bought, 4 months",Good Product,B072QD8QKL
Super,Good,B072QD8QKL
Fine,Fine,B072QD8QKL
Very good smart feature and picture quality,Nice LCD with awesome price,B072QD8QKL
"Good picture., Sound quality really advance, Good to have, Amazing for middle to higher",Don't miss out,B072QD8QKL
"Picture quality,sound quality",Best tv,B072QD8QKL
i purchased product at price 4999/- its good product at this price . picture quality is nice .,Good product at low price,B072QD8QKL
I use this as monitor for my pc and tv. So far so good and satisfied with product.,Worth for each penny,B072QD8QKL
Super,Good,B072QD8QKL
Best work,Thank you,B072QD8QKL
I am using this product with CCTV Cameras. It is kept switched on for long hours and is giving excellent service. Its automatic turn off timer switches off the TV at regular intervals,Excellent product,B072QD8QKL
Audio quality is best for the price range. The TV is pretty light weight so easy to wall mount or place on a stand. The number of ports provided is more than sufficient. The TV can be operated without a remote in case of emergency. The picture quality is average but good in this price range.,Best Economical TV,B072QD8QKL
In Budget,In budget,B072QD8QKL
Picture Quality and sound both are good. We can prefer this product as this is economically cheap and provide you all features compare to others. But most important is its poor service. They can't able to provide any service. You have to manage it self in warranty also. Even they could not send their representative for installation after 13 days of delivery. But they will call you many times to fix the date and time Teliphonically and forget it.,Good product and poor service,B072QD8QKL
"It is a good TV which is not smart, but picture and sound are reasonably good.",Good tv,B072QD8QKL
Good,Good,B072QD8QKL
Picture quality is no.1 Smart feature . Full HD LED display. Super dolby sound.,No.1 TV in the world😀😀😀😀,B072QD8QKL
Very good,Good,B072QD8QKL
Installation process still not completed... How to interact with installation person,Installation process,B072QD8QKL
"I was a bit sceptical to buy this brand, but it turned out to be very good, the pictures are sharp and the sound quality is good. very easy to install and value for money.",Quality is good,B072QD8QKL
Good tv in affordable price,Good quality,B072QD8QKL
Awesome! Value for money thankyou amazon,Worth each penny!,B072QD8QKL
Good quality,Good product,B072QD8QKL
Good product,Good,B072QD8QKL
Nice product,Nice,B072QD8QKL
Good,Super,B072QD8QKL
Decent product on a budget Picture quality : good Sound quality: good Free Installation on the next day of delivery. So far experience with this TV is good,Nice product,B072QD8QKL
"Picture quality is ok, sound is loud, don't expect the bass from soundbar.",Best in class,B072QD8QKL
Best one,One of the best,B072QD8QKL
Good,Cheep and best,B072QD8QKL
Great product at this price,Good TV at best price,B072QD8QKL
Nice one,Nice,B072QD8QKL
Gr8 product for vry reasonable price. Picture Quality and sound is gr8 for the price range. Total value for money.,Total value for money!,B072QD8QKL
