reviews_text,reviews_header,Asin
Sound quality and the interface is awesome. The picture quality is good but could have been better. Sometimes amazon prime takes little more time irrespective of available internet speed. But the overall experience is good. It is value for money.,Superb sound quality.,B07W5QZQ45
"Very nice product , I loved it and also it has very good slim look and design space is well utilized. I would definitely recommend this product as it's worth every penny for this product",One plus always good at design,B07W5QZQ45
One can use this silicon cover doe rha oneplus remote...very useful.. Dealfreez Protective Case for... https://www.amazon.in/dp/B07W818653?ref=ppx_pop_mob_ap_share,Oneplus Remote cover...,B07W5QZQ45
"Got installed today, but disappointed with sliding sound bar not working... It slides up and down three times and gets stuck..open.",Sliding bar issue not working open and closes three times,B07W5QZQ45
"PRODUCT IS VERY GOOD, BUT THE SERVICE PROVIDED BY AMAZON IS TOO POOR. Installation service not provided till 10 days, complained many times with Amazon Customer care & One Plus also, at last got installed by local technition who charges Fee 1500 rupee.","Product is good, But Service of amazon is very poor, installation not provided",B07W5QZQ45
"One of the best tv till today 👍,the quality of picture is very nice , the sound quality is good but could be better . Very snappy os , very smooth . The features of remote are suffecient . When the tv gets Start ,feel like let it be run .",Leading from the front,B07W5QZQ45
QLED DISPLAY IS AWESOME AND I LIKE SPEAKERS. VALUE FOR MONEY. AND REMOTE IS CHARGABLE. I LIKE IT VERY MUCH.,ONE PLUS IS VERY NICE QLED TV.,B07W5QZQ45
Totally unsatisfied with the kind of time they take for installation date. I got appointment for TV Installation after 20 days and rescheduled date after another 15 days. It's better you don't buy this kind of TV then.,Not upto the mark for money you charged.,B07W5QZQ45
One Plus TV Q1 Series Is Simply Amazing ! As per market survey The One Plus Providing All The Features In One TV Which Is Relaible in Cost Too. The Overall Experience Is Great as well as the Installation Service Is Also Best !,Best Buy,B07W5QZQ45
"Installation service not done yet,Amazon better you don't handle if you can't give services correctly.... Offline buying is far better.. So many people are complaining about installation service but nobody is responding to it...👎👎👊👊","Worst in installation service, no one is responding....",B07W5QZQ45
The TV is great but the service provided by amazon is the worst I have received. I did not get the free installation. I claimed for warranty which I'm not getting my remote is not working since past 5 days Just worst kind of service from Amazon,Great Product but worst service,B07W5QZQ45
Don't buy this tv and specially from Amazon free one and half month i didn't get positive response from Amazon or ONEPLUS i received defect piece.,Don't buy,B07W5QZQ45
"Remote control not working properly.working with power supply connection, if power supply removed from power plug it will work only one hour .after i want on tv then connect power suply then only I can power on the TV.",Remote not functioning properly.,B07W5QZQ45
"Picture clarity is good, but no Netflix, sun nxt apps. And also no customer care support. It is difficulty for parents to use. TV is for long term use and it is not like phone that we upgrade often. So please think before you buy.",Think before you buy,B07W5QZQ45
Picture quality is good but sound quality is not such good as mentioned. Remote battery life is excellent.,Good but not as expected.,B07W5QZQ45
"Product is very good, but after purchase service is very bad from amazon. one plus sholud have cancel the partnership with amazon.",Amzon should work on after purchase service provided,B07W5QZQ45
"Excellent picture quality. Need software updates based on user feedbacks. Mobile app remote is great feature. Need mute option, there is no fast forward in apps vedio using mobile remote",Worth of money,B07W5QZQ45
"Good TV, sound/ picture quality performance is v nice, Remote is cool, but the menu button is not working properly and that is manufacturing defect. Also NETFLIX dont work a big disappointment","Do not support NETFLIX, otherwise Good TV",B07W5QZQ45
"Good display.HD comes out great. Netflix needed. No one came for a proper demo after installation. Service may be a problem,to contact whom if any problem occurs?",One + TV ...a visual treat,B07W5QZQ45
Awesome display! great sound!..,Very nice product by one plus,B07W5QZQ45
Superb but required technical support to explain features. Concern technician is very arrogant & asking money for installation.,Need to improve technical support to customer,B07W5QZQ45
"No Netflix app supported yet, I am currently using my fire stick to browse Netflix, and the os needs updated for smoother experience",OnePlus tv review after a month,B07W5QZQ45
Remote awesome 👏 User friendly functionality 4K Picture Quality is Good Image quality With WiFi speed varies but not buffers.. Connectivity options 👍👏👏,Awesome features with advance technology,B07W5QZQ45
"Amazing manufacturer in digital electronics, highly impressed with the product Oneplus makes..",Cool,B07W5QZQ45
"Installation not yet happened.. None called me for installation. I bought the TV on Oct 04,2019. Huge disappointment.",Need for installation,B07W5QZQ45
"I ordered tv on 26th October, I got installation date for 6th November. Almost waited for 10 days. While installation we find that tv screen has damage. One plus tv is new to the market. Don’t want to take risk I send it back .",Screen damage,B07W5QZQ45
Good quality,Good product,B07W5QZQ45
In the beginning the picture quality wasn't that good because of over brightness and contrast issue but after the update now it's perfect. With the sound bar you will get theater experience.,Worthy the money,B07W5QZQ45
Amazing quality. Awesome product from an awesome brand.,Lovely,B07W5QZQ45
OnePlus TV is super. Enjoying it. One thing oneplus can consider is the wall mount stand. As lot of other brand wide variety of wall mount stands oneplus can adopt similar kind of models.,Wall Mount stand can be enhanced to latest variety.,B07W5QZQ45
One plus tv to be no1 tv seen till now,No1 tv,B07W5QZQ45
Excellent,One plus tv,B07W5QZQ45
Excellent,Excellent,B07W5QZQ45
"Picture quality superb, sound is amazing, value for money...",Awesome QLED From One plus,B07W5QZQ45
Very bad product & customer service,Defect product supply by supplier,B07W5QZQ45
Installation is notbeing done by your service providers,Installation not done,B07W5QZQ45
"The panel is great no doubt, one plus really needs to figure out installation . Also how long does it take to get Netflix on this, it's annoying beyond words, Netflix put out the announcement over a week ago!!!",Super TV horrid customer support useless without NETFLIX,B07W5QZQ45
Excellent sound quality and picture quality . i really enjoyed with Q Led tv.,Excellent,B07W5QZQ45
"While playing 4k movies through USB port, dolby atmos is not coming. Video is buffering and not at all supporting for 4k videos and dolby atmos.",Dolby atmos is not supporting,B07W5QZQ45
Superb quality and value for money,Superb,B07W5QZQ45
Useless,Useless product,B07W5QZQ45
This is very good product and it has value of spend money. Thanks Amazon for handling such kind of products.,Great deal,B07W5QZQ45
High price and sound quality is not too good. But over all product is good,Sound quality is not good,B07W5QZQ45
"Excellent, best of the best, many successful",Best Experience,B07W5QZQ45
Super tv,Budget tv with extreme options,B07W5QZQ45
You can not run Netflix on this TV. It is not solving the purpose for which we took this tv.,Netflix not available,B07W5QZQ45
Great TV with great spec's,Excellent TV,B07W5QZQ45
"Love the picture quality on the TV, especially with high quality content. The sound is amazing. Don't feel the need to buy a soundbar with this.","Brilliant picture quality with 4k content, fantastic sound",B07W5QZQ45
Value for money,Perfect buy,B07W5QZQ45
"I loved the TV performance. Built quality, picture and sound quality, everything awesome about it",Best buy. Loved it totally,B07W5QZQ45
Picture quality very good,Best product,B07W5QZQ45
Picture and sound quality is awesome as I have sony oled too so I’m comparing both. Remote should have more buttons as i am unable to pair with my Airtel dth.,Nice product,B07W5QZQ45
"More colours of display like Red , Blue and Pink are saturated kindly fix the issue.",Overall good product but one plus have to do it's best in TVs.,B07W5QZQ45
Quality is not up to the mark,For a QLED tv it is not comparable to Samsung,B07W5QZQ45
Best tv to buy,Good tv,B07W5QZQ45
Best visual & sound experience you can get,Best visual & sound,B07W5QZQ45
The tv per se is excellent... the only minor issue is with remote design (though my kid likes it) and non availability of Netflix... can't be accessed even through built in chromecast,Good tv,B07W5QZQ45
Damaged,Damaged,B07W5QZQ45
"I have recently purchased one plus TV from amazon,TV was fabulous, as always Amazon had delivered it on time. One more thing contarray to other buyer i got installation done on time as well.",Worth to buy,B07W5QZQ45
Sound is quality is not expected even picture is displaying in pink colour some times,Sound and picture quality is not expected,B07W5QZQ45
Awesome TV..but pricing a bit high when compared to the similar TVs of other companies..but it's forgotten while watching 4K stuff on the TV.... spellbinding....,Awesome,B07W5QZQ45
Soundbar is not going inside. Nobody turned up for installation. Poor service.,Poor service,B07W5QZQ45
Theater like experience.,Good,B07W5QZQ45
... its equal to samsung qled in picture clarity...,Excellent,B07W5QZQ45
Stunning picture quality. Sound quality is impressive. The remote is something unique with a USB charger. Value for money as far as QLED TV go. Oneplus need to add NETFLIX support.,Very Good,B07W5QZQ45
Hopeless Service by Installation Provider.... Had to get it installed myself!!,Better go for Samsung if your Budget allows! Over-Hyped,B07W5QZQ45
The product was delivered on time. The installation was done at the time of delivery itself. Picture quality and sound is amazing. Value for money product,Best tv to buy at the price point,B07W5QZQ45
Need to change option when tv is ON I need hdmi 1 port to default option when tv is ON,TV ON default option should be preferable,B07W5QZQ45
Good picture Quality and sound,Very Good product,B07W5QZQ45
Very good product.. with to buy it..,Good product 👍 👌,B07W5QZQ45
We are absolutely enjoying the quality in all parameters. Installation guy was friendly. I think this tv is best for wall mounting.,Great experience,B07W5QZQ45
"Tv is good but it’s very difficult for aged person to operate.Now a days technology is very easy and user friendly,so make it easy for all categories.",It’s Not user Friendly don t take any one please,B07W5QZQ45
Picture quality is awesome whike watching full hd/ 4k content,Picture quality and sound awesome,B07W5QZQ45
Not worth the price..,Over hype it's just an another tv,B07W5QZQ45
Picture quality is good and sound qualoity is awesome its value for money ☺️,Value for money,B07W5QZQ45
excellent,worth,B07W5QZQ45
"Like the TV ,miss the Netflix option",One plus tv,B07W5QZQ45
Over all TV is good and has many features. recommended for new buyers,Best Andriod TV in the market,B07W5QZQ45
DISLIKE as we brought the tv on dhuseera now till Diwali it's now working properly skin color looks pink pink and blue patches comes over all the frame,Very bad,B07W5QZQ45
Awesome product.. Value for money.. Installation on delivery time Picture n sound quality gives u immense IMAX effect U can purchase blindly,Awesome experience,B07W5QZQ45
"I liked the TV very much .Waiting for Netflix to roll on .But ,They did not give charging cable for Remote .",Good Tv .Sound and Picture Clarity Super,B07W5QZQ45
When I ordered on first day sale they haven't mentioned it is coming without stand. Need to buy a stand. But overall picture quality is amazing worth buying.,Excellent TV with flagship features,B07W5QZQ45
I just bought the masterpiece today only and It was delivered on the said time and on the spot installation. Very Excited to explore the features,Just terrific at this price:: go for it,B07W5QZQ45
"Very nice picture and sound quality for the 69900 rupees tv, thank you OnePlus.",Very nice,B07W5QZQ45
200% best product I am very happy to use this,200% more value and nothing compare to it,B07W5QZQ45
The warranty service is non existent. Amazon has cancelled the warranty claim 3 times without service. Terrible blatant and no service,Zero warranty service from Amazon or provider,B07W5QZQ45
Product is awesome but Amazon service is pathetic...,Product is awesome but Amazon service is pathetic,B07W5QZQ45
"Best picture quality and excellent sound Remote design is gud but lacks major functions like mute,source .",Premium TV in Reasonable price,B07W5QZQ45
It stops when we connect to HDMI like.. Sun direct.,Waste,B07W5QZQ45
Sound system is completely messed up. Waste of 60+k,Waste of your money,B07W5QZQ45
Tv is good but but worst installatiin service from 247 installation....Guys dont come for installation. I have manually install the tv and paid for it.,Tv is good but 247 worst installation service,B07W5QZQ45
"Hangs repeatedly, I will never recommend purchase..",Slow and not up to mark..,B07W5QZQ45
Picture quality more saturated. Tv gets restart automatically once i try to connect my android mobile with TV.,Picture quality is more saturated,B07W5QZQ45
Picture and sound quality superb,Worth buying,B07W5QZQ45
Very satisfied with the overall experience of the TV. I feel the lack of Netflix support until now is the only con that I have experienced.,100% Satisfied with the smooth experience & an awesome picture quality.,B07W5QZQ45
there is a no service center nearby ;poor post purchase service,bakwas item sell by amazon,B07W5QZQ45
Superb picture quality loved it.,Awesome picture quality,B07W5QZQ45
Awesome sound quality and picture quality also good.,Good product.,B07W5QZQ45
Picture quality is excellent Sound quality is excellent,Great tv with best price,B07W5QZQ45
"Excellent picture quality, sound and built.",Great TV 📺,B07W5QZQ45
Worth buying,Excellent Television,B07W5QZQ45
"Technician who came for fitting job is worst when we called him , he is not even replying . Very bad service for good product like 1+ tv .",Bad service while fitting,B07W5QZQ45
Very nice product and good picture quality.small bad in remote no mute botton. Every thing is fine and good product.good quality..nice,Nice tv,B07W5QZQ45
Nice Product,Nice Product,B07W5QZQ45
"The best tv with dolby ,best sound experience qled was awesome, overall super tv with low cost,but Amazon people will cheat you be care full","Super tv,but amazon people will cheat u",B07W5QZQ45
Oneplus Tv QLD Product is Super. Picture and Sound Quality is Very Fine but Tv Instolation Amazon Service is Very Bogas and I am Disappointed,Rajesh Patel,B07W5QZQ45
Best tv to buy at this price range..!,Good product,B07W5QZQ45
Awsome television with excellent picture quality and smart TV features. Nowhere comparison with primum brands at this price range.,Awsome television with full smart features,B07W5QZQ45
Great product. Good acoustics and super picture quality,Price worthy,B07W5QZQ45
Great for one time investment lets hope that the tv lasts long i.e. value for money.,Ist tv valued investment,B07W5QZQ45
Tv is awesome good sound quality great display performance but price is little higher....it would have to be around 50k to 60k range....,Best tv but little a bit Overpriced....,B07W5QZQ45
Excellent Picture quality and Sound.,No. 1 In QLED Series,B07W5QZQ45
Good picture quality & sound system,Nice,B07W5QZQ45
Only Netflix not available,All good,B07W5QZQ45
The tv restarts some times afeter connecting wifi,Average,B07W5QZQ45
There are frequent a-v lags which gets corrected only upon restarting and obviously Netflix update is still awaited,Need software updates,B07W5QZQ45
Picture quality sound quality can not be checked as no idea when anyone from amazon or oneplus is coming to install the tv,Waiting for installation,B07W5QZQ45
Picture Quality at the best.,Awesomeness,B07W5QZQ45
"All features are good. But, feeling normal sound even tv volume @ 100. But I didn't check with DTH connection.",TV,B07W5QZQ45
Awesome TV. YOU CAN BUY IT. IT IS VALUE FOR MONEY. NO NEED TO WORRY. EVERYTHING IS AWESOME. SETUP IS SIMPLE.,Worth for money. NICE.........,B07W5QZQ45
Sound Quality Could Have Been Better..,Sound Quality Could Have been Better,B07W5QZQ45
amazing experience with picture and sound,amazing product,B07W5QZQ45
Superb tv with cost benefit from Amazon Wonderful sound no need of extra sound system,Amazing,B07W5QZQ45
What more can you expect from a QLED costing just 70k with bank discounts and cashbacks.,You just can't beat this beast !,B07W5QZQ45
"Best TV ever purchased , love the sound picture quality and everything about tv.",Best TV ever,B07W5QZQ45
installation at the time of delivery is not happening at our 530026..one more half day leave is required... 😔,Delayed installation,B07W5QZQ45
Good,Good tv,B07W5QZQ45
"Can not compare with Sony picture quality , but it worth the money invested",Excellent,B07W5QZQ45
"Very good picture quality and sound, Crystal clear pictures",Very good,B07W5QZQ45
Not they best in tv,Quality,B07W5QZQ45
This product is very good I like this TV.,Very good product,B07W5QZQ45
"Implicit data transfer functionality is very minimum, based on app on the app store only",Impressive,B07W5QZQ45
Good product,Awesome,B07W5QZQ45
The product is worth the money,Review,B07W5QZQ45
Picture quality and sound quality are very good but the 1TB hard disk is not working on OnePlus tv but i can do,Good,B07W5QZQ45
It's worth buying products in QLED Section. sound & picture quality awesome. best product,Best QLED TV,B07W5QZQ45
My sister loved this surprise.,Block Buster entry of One plus TV,B07W5QZQ45
Everything is good experience,Good reviews and quality,B07W5QZQ45
It is an all rounder. Can't say how much I love this TV,MINDBLOWN !!!!!!,B07W5QZQ45
TV quality is good but delivery was very late. No technical person has come for installation.,Overall Experience is not good,B07W5QZQ45
All is well,Well,B07W5QZQ45
"The OnePlus TV is a 55"" 4K QLED TV that comes with Android TV OS. It has 3GB Ram and 16Gb Internal Storage. I have the Q1 Pro variant with me. The display and Sound quality are amazing. The sliding out speakers with the glowing LED is an absolute delight and something new. I have been using the TV from the launch time and here are my observations. -------------- ⏩⏩ Pros: -------------- 👍 4K QLED display is amazing. The color pop out and the Blacks are deep giving a great viewing experience. The screen is bright and the option to control back light is useful. 👍 Dolby Vision, HDR10 and HDR10+ support for watching selected content in High dynamic range. This helps a lot in improving the viewing experience. 👍 Dolby Atmos support for improved audio quality. 👍 Minimal bezels for immersive viewing experience. 👍 Has many Input ports for multi-utility. 4 HDMI 2.0 ports, 1 Ethernet, 1 USB 3.0, 1 USB 2.0, 1 Optical, 1 AV and 1 RF. One of the HDMI supports ARC. 👍 The 50W speaker is loud and clear. Front firing gives a better audio experience. 30-40% volume is sufficient for a large room. The LED lighting and sliding out feature is surely an attraction. With bluetooth stereo, the LED on the speaker even blinks with the music like a visualizer. 👍 Android TV OS. This provides access to tons of Apps and games. The software updates are promised by OnePlus for 3 years. Already got an update that improved the HDR performance. 👍 Connect App for controlling TV from the Phone. Useful for multitasking. 👍 Chromecast Built-in. So you can easily cast videos, photos and other media with a click. No need to connect every time. 👍 Screen mirroring is supported and works smoothly. 👍 The remote can be recharged by a regular charger. No need for AA/AAA batteries. 👍 Bluetooth connectivity. 50 W speakers can be used as Bluetooth Speakers with the Stereo Option or you can connect a Bluetooth headphone to listen in isolation. 👍 TV can be controlled by Google Assistant and Alexa enables devices. -------------- ⏩⏩ Cons: -------------- 👎 The Software needs some improvement and hopefully it will be improved in time. 👎 The native video player needs improvement as it struggles to play some video file formats. 👎 HDR optimization needs improvement in regards to colors. 👎 The remote though looks super sleek and trendy, it's not a practical approach. No Mute button and changing 👎 TV channels is a hassle by navigation keypads. So not Elderly friendly. 👎 The Table top stand is not stable. It wobbles even with a small touch. 👎 The extra price for the Q1 Pro variant. 👎 No 3.5mm Port. 👎 Control options with Google Assistant and Alexa to be increased. --------------------- ⏩⏩ Conclusion: --------------------- If you are looking for a TV with QLED 4K Display and Android TV OS, then OnePlus TV is a good option to choose, provided you go for the Q1 variant. As this is the first product in TV segment for the brand, the service might need some time to establish well.",Great Option for People who want a QLED 4K TV| Read before you buy 📺🤩,B07W5QZQ45
"Display and sound Quality is Awesome, Installation process also very smooth.","Best Display Quality, Sound and Sleek Remote",B07W5QZQ45
Sound quality is very nice,Sound quality very nice,B07W5QZQ45
Picture quality is as good as expensive brands but the sound is average. 100% worth buying.,Lovin it...,B07W5QZQ45
Wonderful,Very good,B07W5QZQ45
No mute button in remote,Very good quality picture,B07W5QZQ45
TV SCREEN DAMAGED FULLY..I WANT URGENT REPLACEMENT... PLEASE SEND ME NEW PIECE..AS SOON AS POSSIBLE.,DAMAGED TV FOR REPLACEMENT FOR NEW.,B07W5QZQ45
Picture & Sound quality is too good ... And the value for Tv is Affordable 😍... so go for it guys,Awesome experience 🔥,B07W5QZQ45
Awesome experience on watching 1+....really oneplus is super plus ...worth for money .,Value for money...go with oneplus u really enjoy a lot,B07W5QZQ45
The best in this segment. Paisa vasool...,One plus 55 Inch TV,B07W5QZQ45
Has beautiful features and amazing picture quality with apps like Netflix and Amazon prime especially,Very good,B07W5QZQ45
Best tv i have ever seen No brand can give this type of tv in this cost Very very satisfied,Top tv with cheaper cost,B07W5QZQ45
MAST,BEST,B07W5QZQ45
Amazing sound quality truly value for money..,Big thumbs up 👍,B07W5QZQ45
Got defective piece and not getting replacement . Worst Experience with Amazon service center.,Worst service by Amazon. one plus should give another website this tender.,B07W5QZQ45
Tv ooook..but installation service is very very bad,Very bad installation service,B07W5QZQ45
"Installation team has yet come even after 20 days of purchase,Amazon prime is not working",Don't go for OnePlus tv,B07W5QZQ45
Software needs to be improved however panel & picture quality is superb!,Good but room for improvement,B07W5QZQ45
"Flagship TV on the market , go for it","Flagship TV on the market , go for it",B07W5QZQ45
Perfect,Very good,B07W5QZQ45
"Excellent product, loving it","Excellent product, loving it!",B07W5QZQ45
So far so good,Good initiative by One Plus team....hard work pay's well,B07W5QZQ45
Waste,Waste,B07W5QZQ45
Best,Right,B07W5QZQ45
OnePlus 138.8 cm (55 inches) Q1 Series 4K Certified Android QLED TV 55Q1IN Pro (Black,OnePlus 138.8 cm (55 inches) Q1 Series 4K Certified Android QLED TV 55Q1IN Pro (Black,B07W5QZQ45
It is good,Dolby vision,B07W5QZQ45
Good tv but no Tv instalation home service.... And amazon tv packging not good..my tv crach,No Tv instalatin extra paid 1500 Rs in pravite tv instalation team,B07W5QZQ45
The installation person did not show up..what do I do with the tv if it cannot be installed,Bad installation,B07W5QZQ45
Good picture quality and good sound quality. But amazon not provided installation services.,Value of money,B07W5QZQ45
No. Netflix.,Ok,B07W5QZQ45
Ek number,Ok,B07W5QZQ45
Awesome TV,You won't regret it!,B07W5QZQ45
"Product box was soo wet😠 Not konw about the product , Waiting for installation",Product box,B07W5QZQ45
Installation is a big problem very unprofessional,Great product Bad service,B07W5QZQ45
****Nice Tv*** Great picture guality Lack of IR sensor,***Nice Tv***,B07W5QZQ45
"TV quality, watching experience is too good , amazing sounds audio quality Must buy",1+ एकदम कडक,B07W5QZQ45
"Amazing picture quality nd sound, all features and performance are fantastic....",Stunning...,B07W5QZQ45
Picture quality very good os remote so smote sound is awesome value for money tv,Awesome quality amazon installation service very poor,B07W5QZQ45
A good product,Good Product,B07W5QZQ45
no qualified installation technician.no proper knowledge of functions of the tv,good product,B07W5QZQ45
all is ok found in product &insatslation,very very good,B07W5QZQ45
Good,Good,B07W5QZQ45
Alla are good cost also high but ok Netflix was not supporting very bad,Please give a update of Netflix in OnePlus Q1,B07W5QZQ45
TV was awesome......but the TV stand was not stable worth for money,Worth for money ......,B07W5QZQ45
Picture and sound quality is amazing. My family loves it. Thank you oneplus,Oneplus on all aspects,B07W5QZQ45
The sound quality is very good but the sound that should be in a hall is not rooted,Sound is low,B07W5QZQ45
It is value for money,Best Buy,B07W5QZQ45
Amazing but too expensive. On phone keyboard works for very few apps,Good but buggy,B07W5QZQ45
Mind blowing product,Nice TV,B07W5QZQ45
