reviews_text,reviews_header,Asin
"Delivery was fast but installation & demo part takes approx 6 days.I choose the slot but guy didn't came and completed the installation process of its own on its app.Installation part is not done by 1+,they had given installation to Amazon, Amazon had given to Cloudtail,Cloudtail had given to Qdigi,Qdigi had given to another co.Guy who came to me didn't know how to set correct picture?They only know how to hang TV on wall else nothing. 3.5 mm jack is missing.Colour is better but not the best like Sony.SD channel quality is very poor,HD channel quality is poor.4k quality is good.So,if you have budget go for Sony for the best display and service after sales.If you don't have budget go for budget TV at least you will save money .If you can wait for at least 1 week for installation & demo part you can go for 1+ TV as installation co will say they are overloaded in this festive season as they have to install other company TV's also.2nd execuse will be 1+ TV is new so they don't know all about demo part.Kindly check full hd and SD picture quality before buying any TV as 4k content is not easy available in the market.",Worst installation & demo process of 1 +tv,B07W5QZQ45
"If you have used a One Plus smartphone you're already aware about how the brand gives you value for your every buck spent. If you're someone who majorly consume content online on OTT you should definitely get this TV. Please skip this if you're going to watch your satellite TV as it's still isn't that great when it comes to upscaling SD content. Pros: Brighter screen with vivid colors Android TV USB type chargeable TV remote Loud & clear sound Cons: Poor upscaling for SD content HDR content looks poor as of now Unavailability of Netflix as of now No Table top stand provided Edit: The software update has fixed the HDR issue which I was facing earlier, Netflix isn't available yet.",A ideal TV for binge watching millennials,B07W5QZQ45
"Very impressive picture quality,and very smooth OS. Remote is chargeable like a phone,and the connect app just adds to the experience.",Impressive,B07W5QZQ45
"Being a loyal OnePlus customer since OnePlus 2, had great expections from the TV. So much so that I was amongst the 1st customer to buy the TV on the 28th of September and much to my pleasure the TV was promptly delivered on the 30th. However since then the experience has been pretty horrid to say the least. The installation slot was assigned on the 2nd of October at 10 am but the technician didn't show up until 3 pm, understandably that the technician are busy due to prime sale, I didn't pay much heed. The installation didn't take place that day, admittedly due to my own reservation. Finally after calling and pleading the technician again and again the TV was finally installed on the 5th, but much to my horror, the TV had a crack on the display. Upon taking up the issue, the Amazon team agreed to replace the TV immediately. But to replace the TV the technician has to file a report on the same and because my initial installation slot was on the 2nd, it expired. I was assigned a new slot for the 7th. As of today I am still waiting for the technician to report the TV to be damaged so that I can get a replacement. Given the procedure, even thought I bought the TV on the 28th of September, sadly I won't be able to experience it before the 12th of October. The defected tv is just sitting in my living room since the 30th and just hurting my eyes everytime I look at it.",The review is more to do with service rather the quality of the tv.,B07W5QZQ45
"There are dead pixels on a brand new tv. Called customer care multiple times since last 3 days, no one responding with concrete solution, just buying time. I have my return window till 10 Oct only, Please return or replace. Update: Got the replacement now, and is good so far.",Dead pixels on the TV,B07W5QZQ45
5 Star for OnePlus TV as a Product. 2 Star for the installation Service. TV definitely is a great buy. Great Quality and Dolby Vision. All you can see in different youtube comparison videos. I had options either to go with Samsung Frame of OnePlus. I choose OnePlus because do not want a dedicated Art TV and samsung art TV is loaded with bloats. I myself compared both in person now I see they are almost similar. Game Of Thrones final episode on both the TV is not perfect but better than many other TV in the price range of under 1.2 Lakh. Though OnePlus is a bit cheaper than samsung frame quality is a marginally above Samsung. Sound is great on Q1 and I do not feel reviewing it as installing a separate soundbar with sub woofer is what I prefer. Pros: - Good Price Range. - QLED panel outshines everything in your living room. - Android Mobile Apps APK sideloaded are cropped towards left. (something they may need to fix. Cons: - No Cons for TV. - Amazon service is pathetic. They denied installation at my pincode and I had to go with many troubles for getting it installed locally. (it goes away from buyers pocket),Amazing TV - Poor Amazon Service,B07W5QZQ45
"Any one getting pink screen? TV has major fault of showing pinkish colour. Tried resetting TV many times. Got a defective piece. Left Half the screen was black. I must be the one in first 5customers of this TV in my town, got the tv in prime sale installed even before it went on official sale. Had such a difficult time with Amazon to get it replaced. They took 11+ days to get it replaced. That's after 7-8 hours of overall phone calls to Amazon and one+ call centers . it was quite frustrating experience. Everything that is expected from this TV is beyond expectations. All clutter is gone from my tv set. Most imp, this TV got I build sound bar with amazing quality. This helped me get rid of all wiring and devices that were required to get good sound from flat TV. You need only one wire that's power cable if nt using any hdmi source. Picture is amazing. Adjusting colors not easy. Still Having trouble to make color calibration work effectively with my ps4. Internet connectivity is amazing Adsusting sound is not easy. No preset sound modes. Remote is small sleek and useful. But not very responsive. It takes time to get response back from TV. Remember!!!! TV screen is very very very delicate. Be careful if you plan to relocate. Installation people don't know much about installation. Stand beside them to check if they follow instructions that came with TV.","Best quality picture, sound, internet and remote",B07W5QZQ45
Day1: This z my first smart tv so unable to compare with other tvs..but this QLED was awesome...enjoying Edit1: I got a defective product...the picture is showing some pinkish/reddish showing other than actual colour.i need to change the settings daily for this issue,Waiting for Netflix,B07W5QZQ45
display and sound is stunning,Awesome quality,B07W5QZQ45
"The TV is exceptional, the sound quality amazing. The thing that lets the experience down is the remote, having no mute button is especially irritating and a long press on the volume down key doesn't serve that purpose as usually it does in Mobile devices. There is also no source button, and the tv always to defaults to the Android screen. Not the last source input screen. To watch TV for elders in the house, it proves to be too much to handle. Image processing is weaker than Samsung or LG but I am hoping software updates might improve the algorithm. HD and UHD content is good but sd is horrible. (Alexa or Google assistant aren't able to mute or change source like apple home kit, adding that function might greatly improved this experience) Verdict: no brainier if you have only people less than 50yrs old in the house. Side note: The installation experience was a nightmare, that is more of reflection on Amazon home services who sent one person to do the entire installation of this 55inch qled. After a lot of calls, they sent a decent engineer and his sidekick very late in the evening. Almost ruining the entire day. That's all. I can add more photos /videos but I am recording with my phone so the excellent sound quality might not be reproduced.","Everything is great, but the remote...",B07W5QZQ45
"Did not like the TV at all. go for Samsung LG or Sony in similar price range to get all the apps running falwlessly. Very limited apps available, Netflix not available. Neither am I able to cast Netflix from my OnePlus 6t phone. Picture quality is far better when same app being played using fire stick compared to native apps. Native Prime video app also sucks. Expected much more from OnePlus, the playstore contains very limited app, almost of no use. I had a 4k TCL smart TV of cost around 30 k, I felt this TV is not doing better in any ways. The sound quality is better, but one still need good sound system.","Not at all like a OnePlus product, totally disappointed",B07W5QZQ45
"I booked the TV on the first day, just believed in OnePlus brand. But its a big letdown from them for their loyal customers. My TV have defects and I have been following up with customer care many times to sort that out but in vain. Problem: Whenever put the TV to standby from live channels and power on, it doesn't goes to live channels directly but it goes to apps page and you have to use your TV remote choose the input and then you have to use the settop box remote. Similarly, power off the TV should power off/standby the settop box as well , but it doesn't do. For both of these options are available in TV , but it doesn't work for my TV. Customer care team doesnot have any knowledge about the TV , everytime they say they will come back with solution but it never worked but they still close the case. Remote is too small to hold and have delicate buttons. It is difficult to keep it safe. Rest of them are fine.",Many defects and poor support from customer care,B07W5QZQ45
"good product but its supplying without table top stand . Nothing Special its a ordinary Television with lot of Hype created in market . you can not compare with Sony, Samsung product, its a ok ok product , not so happy with this purchase and quality of TV.",One plus lot of Hype created about the TV but actially a ordinary TV,B07W5QZQ45
Pros: + Brilliant display + Sleek rechargable Remote + Excellent sound ( I decided not to get a sound bar anymore) + Very thin bezels + Easy remote on any android phone Cons: - Non-pro version doesn't come with a table top stand - Default wall mounting stand gives very less space behind the TV - Don't search for more Cons 'cause there are none,"If you are looking for 55"" TV, go for this one",B07W5QZQ45
"Pros Good design Great SDR performance Good audio quality Handy smartphone control app Cons Disconcerting build quality Poor viewing angles Mediocre HDR performance Silly remote design No AirPlay 2 High price For that price, you are getting a television with good design, good SDR performance, and good audio. The mobile app is also handy and offers a few more features than what we normally see in these apps. Unfortunately, the build quality is concerning, the HDR performance isn't impressive, the display has mediocre viewing angles and uniformity issues and the remote is frustrating to use. We also expect some added niceties at this price like AirPlay 2 support, which is missing.",Not worth the Hype!,B07W5QZQ45
"Nice product.,,, and fast delivery. One plus tv has supreb quality. Worth to buy",Nice tv... Value for money,B07W5QZQ45
I ordered this TV as a birthday gift for my father. Delivery was on time but product turned out to be damaged. TV never turned on at all. Unfortunately had to return it. WHAT A SHAME.,NEVER TURNED ON.(PERIOD),B07W5QZQ45
Can we open and install one plus tv or will any technician come to install?,Who will install one plus tv and when? Customer care no of one plus tv is not working,B07W5QZQ45
My product is still in the box and no one coming to install it neither amazon is doing anything for the same.,Poor Installation Service,B07W5QZQ45
"Ok guys so, first of all, let me tell you that I was totally confused while buying this tv. There were a few concerns in my mind: 1. This brand is a well know brand in Mobile but it's their first TV, So is it safe to buy ?? 2. I am getting 55-inch tv ultra 4k at price like 35k, so should I invest 70K in TV and get the same 4k tv? 3. Should I wait for other brands like Sony, Samsung, and LG to decrease the Price of their costly TV and buy them? 4. Ok if I want to buy One Plus TV, should I buy 70k one or 1 lac tv? Answer: 1. Yes, it's right that this is Oneplus first TV but I think we should decide whether to buy this or not by seeing the feature, component, and equipment which they have used on TV. After all the equipment matters more than who assembles it. If you see the specification and component used Like Panels screens speakers, all are very good and of high quality. So definitely this TV is a very GOOD TV. It's just awesome. 2. Now if you are comparing this with TV-like MI and TCL etc around 30 - 35 K budget then u are totally wrong. These low-end tvs are not providing high-end parts and components in the TV as one plus tv. After a year use these low-end tvs start getting slow and lags bcz there are no updates given by service provide on an old tv. These service provided launches 2 -3 tv every year and they forget old tv. Now one plus clearly told they will give update upto 3 years min. so that means this tv is not going to be slow or have any software issue. 3. If you want to wait then you can wait. But let me tell u something these giants tv company if they reduce the TV Price then also they will not give high-end specs. they will reduce the feature like instead of 4 HDMI 3 HDMI, sound output will be reduced from 40watt to 20 or 10 watts and many more things. 4. If you ask me, you should buy 70 K tv not the 1 lac tv as it has only soundbar extra. Many of you will already have the soundbar /speaker in your home or even you don't have, you can buy them at lesser price in some offer. I don't think spending 30k just for the speaker makes sense. Plus, its a motorize speaker so every time u switch on tv it comes out and so on. It is bound to have wear and tear in the future. But again it's up to u what u want to buy. Pros: 1. Sound 50 Watt ( Dolby vision and Dolby atmos certified TV) 2. Picture quality ( QLED Screen is just awesome.) 3. Oxygen OS/Play ( it is so smooth like a hot knife on butter) 4. Build Quality 5.Remote (awesome remote, trust me you won't miss mute button on this remote as many are telling in youtube) Cons: 1. I am going mad in searching for one con on this tv, but I haven't found anything yet. If I find anything I will update my review. Watch this space for more update.",BEST QLED TV. Trust Me!!,B07W5QZQ45
"My overall experience with this TV Update after 1.5 month: 1) Received new replacement remote in about a months struggle and it is working ok and not charged since 15 day. 2) Experience with oneplus service was worst amazon is still novice in managing warranty claim of product. 3) I don't feel the purchase of this TV was worth even after receiving discounts. I should have gone for Sony or VU as this one is somewhere in middle and considering service support and cost premium it is not wise to go with this product. Update after 14 days: 1) Oneplus don't have there exclusive warranty service provider for tv. 2) The agency they have hired for service are expert in installation (actually mounting on wall) and cover other Chinese brand also and know nothing about TV. 3) Twice placed the warranty claim request on amazon platform. First time no one came. Second time I called amazon twice and pleaded to send technician for I was assured that my claim request will be processed on priority. Finally technician came (late anyway) with drill and hammer in the bag and said he knows installation only he played with remote for sometime asked to call amazon again which have already done. If this would have been a local seller or any other established tv brand I would have definitely managed to get service. 4) For those who don't know - warranty claim for this product can be done through amazon app and not directly by oneplus so Amazon is equally responsible for warranty claims. I am worried that I am stuck with faulty product and oneplus and Amazon don't have ability/service providers to provide warranty services for TV. Review after 5 days use: a) Poor product QA, the remote is faulty and loosing charge completely in 10 Hour. I even struggle to turn on TV as remote battery gets drained and oneplus app start TV only if it was not powered off or shutdown was not done. It can wake it up only when TV is in sleep mode. b) Boot time is on lil higher side when compared with my firetv stick. App loading and switching is faster. c) Sound quality is good compared to any other LED tv, you will not feel need of sound bar unless you are use to home theater system. d) Picture is bright and looks good but doesn't match the SAMSUNG QLED or Sony. It is good far cartoon as color are little over saturated. e) installation experience was very poor. Multiple time amazon customer support made false promises for sending someone for installation but no one came until 12 days. Got it done from outside and got installation checked from amazon technician when he came. f) Installation is simple and when you switch on tv for first time you need to follow similar procedure like for new smartphone. g) Amazon need to train delivery staff on how to open bigger TV box and show TV to customers at time of open box inspection for delivery. There are plugs given near bottom of box which needs to be removed and box is taken out but delivery staff tried to pull out the TV from top of box and my heart came in moth as they were struggling and TV was heavy. I had to guid them on this.",My overall experience with oneplus Tv - Not recommended for purchase,B07W5QZQ45
Display is too good than sony Trilluminus display. Sound quality is very good with dolby atmos.,Very good display,B07W5QZQ45
"Hardware wise, the TV is all good and all. The picture quality, even the SDR content looks pretty decent on such a widescreen. But the software as of this date is at an okay level. They need to work a lot on the coming updates, like adding Netflix, being able to change to video quality in prime video, Miracast (unable to connect my laptop wirelessly to the tv), no data saver mode, etc. When music is played at louder volumes, the base feels muffled, not punchy. So yeah, if these problems are addressed soon, then it's a perfect tv",Is it worth the hype?,B07W5QZQ45
TV is good .... however installation partner VFcare is extremely unprofessional...will not install on time ...had follow-up multiple times. service engineer Did not provide me receipt for wall bracket ..,Installation partner VFcare is not great,B07W5QZQ45
"I bought qled q1 pro the minute it was on sale. So far loving the sound quality with its 8 speaker setup. The HDR content's performance is not as good as I was expected. I experience lag in HDR videos with breakage in sound. Also, there are some bugs like mute command is not responsive via Google assistant. The remote also would have been better if it had separate buttons for play , fast forward and rewind like in Amazon firestick remote. Hope it gets updates for all the bugs and Netflix soon, otherwise the true Oneplus experience will stay missing from this TV.",A good TV but not the best one,B07W5QZQ45
"Trusting OnePlus and Amazon I ordered this product of such rate and now it turns to be my worst choice to get OnePlus's very first TV as it's not at all good with its Android software as it goes to all black screen after sometime of watching which makes it just as much irritating, we have to shut it down by guessing where the cursor would be and then again restart to watch something and then again after 10 mins it goes to black screen. And secondly it's just tooooo delicate which makes the product just not that much handy but a product to be kept in showpiece that hell yeah we have a OnePlus Android Smart QLED TV which doesn't even work properly. My homemaid was cleaning the desk under the TV and her elbow got in touch with the screen and here it is, the big crack appears on the screen. And when complaining to the company, OnePlus says that they don't know why this is happening.. might be some error in panel you have got get your panel changed for the issues you are facing and which will be costing you around 80% of the actual price and also the company can not do anything but I have to concern my problem with AMAZON as they are responsible to fix the issue , I mean what does this brand really want from us?! AND WHEN TALKING TO AMAZON GUYS,THEY TOLD US THAT THEY CAN HELP US BUT TELLING MY PROBLEM TO ONEPLUS MIGHT GET ME SOME HELP. It feels as if I am no one just left in the middle hanging and both the companies standing on either sides and laughing on the situation. Seriously this is mind harrasment for me as I am facing taunts everyday from my family about what an amazing investment I have made. I WONT RECOMMEND ANYONE TO LAY HIS HANDS ON THE PRODUCT.","0 in customer support, 0 in the quality of material used to make this product. Too delicate",B07W5QZQ45
Good in all aspects,Nice product in best price,B07W5QZQ45
"Dark spots appears on the TV. Unable to cast my 1+ mobile onto the TV. Remote is too minimalistic. Watching sports is a total put off. Judder & frame skipping while watching sports and some content. Auto volume reduction does not work as advertised, we'd have to manually reduce the volume. Coloured patches appear on the screen while watching 4k Content. Hoped a lot better from 1+.",Not worth the price tag!,B07W5QZQ45
Worst post sales experience. Avoid buying one plus tv . They won’t give proper post sale services.,Worst installation,B07W5QZQ45
"This review is just my opinion in layman eyes Pros: 1. Display is next level at this price. Need to watch HDR videos to experience the awesome display.. 2. Very user friendly remote app, they have tried and taken mobile remote to next level. Very easy to type. 3. Sound is very good and i don't think you need to go for pro version unless and until you have that budget and you want that fancy sliding speaker. Speakers are loud and clear. Dolby Atmos vision and sound works really well . Even in full volume no much distorsion. 4. Very bright and vivid display. 5. Beautiful, thin and beezles are ver small. 6. Official Android means almost all necessary apps available. Infact I felt that DTH is not required any more 😀 7. Looks MEMC was able to deliver smooth videos for most contents. It works. Cons. 1. When watching normal contents from DTH (SD and HD) needed some effort to adjust picture modes to watch comfortably. It took me time to adjust to watch comfortable. But you can maintain two picture modes with different setting and change when required. This is because high brightness is utilized to produce vivid sharp image for 4k contents but for normal videos display will turn too bright and you need to reduce backlight and brightness. I think this is something that OnePlus need to address in next updates. 2. Need to buy a flexible wallmount otherwise port will not be accessible. Flexible mount costs close to 3k. 3. I found it difficult to link this tv to Alexa.i am still trying. But I am not worried much about this and can't be a deal breaker. This review is from a week's usage. I will update any further observation after a months use.","Excellent display and sound, Wow at first sight",B07W5QZQ45
"Bought the TV and as promised, it was delivered on time. Installation was booked for 3rd Oct but no one turned up while got calls to shift the slot to 18th and then 28th which I refused. Finally amazon cancelled my installation and therefore, I got it installed from the same technician but had to pay 1000. Picture quality is amazing but sound is mind blowing and that too of q1. Non availability of Netflix is irritating. Rather than echo dot, amazon should have given fire stick free. Only con is remote, not very user friendly. Same remote can be used for fire stick if u wish to use it for Netflix or any other app. Few apps like ndtv or jio cinema which runs buttery smooth through fire stick, start buffering on Tv app. As I got 5k amazon cashback and 10% sbi card cashback, its a decent deal. Because of installation issue, I’m giving only 2 stars",Installation service is pathetic,B07W5QZQ45
